[{"schema_version":"1.0","event_id":"EVT-907b34e81593","event_type":"incident_opened","emitted_at":"2026-10-15T16:26:15.513+00:00","stream_id":"cam-01","stream_time_s":9.4,"health_state":"DEGRADED","message":"HEALTHY -> DEGRADED (active: brightness)","incident":{"incident_id":"INC-bbc7ca303ccd","stream_id":"cam-01","opened_at":"2026-10-15T16:26:15.512+00:00","opened_stream_time_s":9.4,"status":"active","health_state":"DEGRADED","severity":"warning","peak_severity":"warning","updated_at":"2026-10-15T16:26:15.512+00:00","resolved_at":null,"resolved_stream_time_s":null,"suspected_categories":["low_light"],"categories_seen":["low_light"],"measurements_at_open":[{"check":"brightness","category":"low_light","value":0.2473,"raw_value":0.205,"direction":"below","enter_threshold":0.55,"exit_threshold":0.7,"severe_threshold":0.3,"active":true,"severe":true},{"check":"sharpness","category":"blur","value":0.8595,"raw_value":0.8454,"direction":"below","enter_threshold":0.4,"exit_threshold":0.55,"severe_threshold":0.2,"active":false,"severe":false},{"check":"obstruction","category":"obstruction","value":0.0,"raw_value":0.0,"direction":"above","enter_threshold":0.15,"exit_threshold":0.08,"severe_threshold":0.4,"active":false,"severe":false},{"check":"framing","category":"framing_change","value":0.9908,"raw_value":0.9906,"direction":"below","enter_threshold":0.7415,"exit_threshold":0.8415,"severe_threshold":0.4915,"active":false,"severe":false},{"check":"latency","category":"processing_latency","value":5.876,"raw_value":3.7915,"direction":"above","enter_threshold":250.0,"exit_threshold":150.0,"severe_threshold":1000.0,"active":false,"severe":false}],"latest_measurements":[],"worst_values":{"brightness":0.2473},"evidence":["t=9.40s brightness=0.247 is below enter threshold 0.550 (held 1.0s; severe at 0.300)","frame: brightness 22.47 (baseline 109.62), sharpness 8.31125 (baseline 9.83091), 640x360"],"recommended_actions":["Check scene lighting, IR illuminator and exposure settings; treat detections from this period as untrusted."],"transitions":[{"stream_time_s":9.4,"from":"HEALTHY","to":"DEGRADED","reason":"active: brightness"}],"detection":null,"detection_context":{"before":{"start_stream_time_s":3.467,"end_stream_time_s":8.333,"frames":74,"frames_with_detection_data":0,"detections_total":0,"mean_detections_per_frame":null},"during":{"start_stream_time_s":8.4,"end_stream_time_s":9.4,"frames":16,"frames_with_detection_data":0,"detections_total":0,"mean_detections_per_frame":null}},"recurrence_of":null,"recurrence_count":0,"snapshot_path":"evidence/INC-bbc7ca303ccd.jpg","claim":"suspected_input_degradation","disclaimer":"Derived from image-quality measurements relative to a healthy baseline. Indicates the camera input changed measurably; it does not prove that detection accuracy fell and does not identify the physical cause."}},{"schema_version":"1.0","event_id":"EVT-824ecfa8a77f","event_type":"state_changed","emitted_at":"2026-10-15T16:26:27.467+00:00","stream_id":"cam-01","stream_time_s":11.0,"health_state":"UNTRUSTED","message":"DEGRADED -> UNTRUSTED (severe: brightness)","incident":{"incident_id":"INC-bbc7ca303ccd","stream_id":"cam-01","opened_at":"2026-10-15T16:26:15.512+00:00","opened_stream_time_s":9.4,"status":"active","health_state":"UNTRUSTED","severity":"critical","peak_severity":"critical","updated_at":"2026-10-15T16:26:27.467+00:00","resolved_at":null,"resolved_stream_time_s":null,"suspected_categories":["low_light"],"categories_seen":["low_light"],"measurements_at_open":[{"check":"brightness","category":"low_light","value":0.2473,"raw_value":0.205,"direction":"below","enter_threshold":0.55,"exit_threshold":0.7,"severe_threshold":0.3,"active":true,"severe":true},{"check":"sharpness","category":"blur","value":0.8595,"raw_value":0.8454,"direction":"below","enter_threshold":0.4,"exit_threshold":0.55,"severe_threshold":0.2,"active":false,"severe":false},{"check":"obstruction","category":"obstruction","value":0.0,"raw_value":0.0,"direction":"above","enter_threshold":0.15,"exit_threshold":0.08,"severe_threshold":0.4,"active":false,"severe":false},{"check":"framing","category":"framing_change","value":0.9908,"raw_value":0.9906,"direction":"below","enter_threshold":0.7415,"exit_threshold":0.8415,"severe_threshold":0.4915,"active":false,"severe":false},{"check":"latency","category":"processing_latency","value":5.876,"raw_value":3.7915,"direction":"above","enter_threshold":250.0,"exit_threshold":150.0,"severe_threshold":1000.0,"active":false,"severe":false}],"latest_measurements":[{"check":"brightness","category":"low_light","value":0.2066,"raw_value":0.2049,"direction":"below","enter_threshold":0.55,"exit_threshold":0.7,"severe_threshold":0.3,"active":true,"severe":true},{"check":"sharpness","category":"blur","value":0.8523,"raw_value":0.8496,"direction":"below","enter_threshold":0.4,"exit_threshold":0.55,"severe_threshold":0.2,"active":false,"severe":false},{"check":"obstruction","category":"obstruction","value":0.0,"raw_value":0.0,"direction":"above","enter_threshold":0.15,"exit_threshold":0.08,"severe_threshold":0.4,"active":false,"severe":false},{"check":"framing","category":"framing_change","value":0.991,"raw_value":0.9913,"direction":"below","enter_threshold":0.7415,"exit_threshold":0.8415,"severe_threshold":0.4915,"active":false,"severe":false},{"check":"latency","category":"processing_latency","value":5.9699,"raw_value":4.8657,"direction":"above","enter_threshold":250.0,"exit_threshold":150.0,"severe_threshold":1000.0,"active":false,"severe":false}],"worst_values":{"brightness":0.2066},"evidence":["t=9.40s brightness=0.247 is below enter threshold 0.550 (held 1.0s; severe at 0.300)","frame: brightness 22.47 (baseline 109.62), sharpness 8.31125 (baseline 9.83091), 640x360","t=11.00s DEGRADED -> UNTRUSTED: severe: brightness"],"recommended_actions":["Check scene lighting, IR illuminator and exposure settings; treat detections from this period as untrusted."],"transitions":[{"stream_time_s":9.4,"from":"HEALTHY","to":"DEGRADED","reason":"active: brightness"},{"stream_time_s":11.0,"from":"DEGRADED","to":"UNTRUSTED","reason":"severe: brightness"}],"detection":null,"detection_context":{"before":{"start_stream_time_s":3.467,"end_stream_time_s":8.333,"frames":74,"frames_with_detection_data":0,"detections_total":0,"mean_detections_per_frame":null},"during":{"start_stream_time_s":8.4,"end_stream_time_s":11.0,"frames":40,"frames_with_detection_data":0,"detections_total":0,"mean_detections_per_frame":null}},"recurrence_of":null,"recurrence_count":0,"snapshot_path":"evidence/INC-bbc7ca303ccd.jpg","claim":"suspected_input_degradation","disclaimer":"Derived from image-quality measurements relative to a healthy baseline. Indicates the camera input changed measurably; it does not prove that detection accuracy fell and does not identify the physical cause."}},{"schema_version":"1.0","event_id":"EVT-14b615103fc9","event_type":"state_changed","emitted_at":"2026-10-15T16:26:43.616+00:00","stream_id":"cam-01","stream_time_s":16.467,"health_state":"RECOVERING","message":"UNTRUSTED -> RECOVERING (all checks back within exit thresholds)","incident":{"incident_id":"INC-bbc7ca303ccd","stream_id":"cam-01","opened_at":"2026-10-15T16:26:15.512+00:00","opened_stream_time_s":9.4,"status":"active","health_state":"RECOVERING","severity":"info","peak_severity":"critical","updated_at":"2026-10-15T16:26:43.616+00:00","resolved_at":null,"resolved_stream_time_s":null,"suspected_categories":["low_light"],"categories_seen":["low_light"],"measurements_at_open":[{"check":"brightness","category":"low_light","value":0.2473,"raw_value":0.205,"direction":"below","enter_threshold":0.55,"exit_threshold":0.7,"severe_threshold":0.3,"active":true,"severe":true},{"check":"sharpness","category":"blur","value":0.8595,"raw_value":0.8454,"direction":"below","enter_threshold":0.4,"exit_threshold":0.55,"severe_threshold":0.2,"active":false,"severe":false},{"check":"obstruction","category":"obstruction","value":0.0,"raw_value":0.0,"direction":"above","enter_threshold":0.15,"exit_threshold":0.08,"severe_threshold":0.4,"active":false,"severe":false},{"check":"framing","category":"framing_change","value":0.9908,"raw_value":0.9906,"direction":"below","enter_threshold":0.7415,"exit_threshold":0.8415,"severe_threshold":0.4915,"active":false,"severe":false},{"check":"latency","category":"processing_latency","value":5.876,"raw_value":3.7915,"direction":"above","enter_threshold":250.0,"exit_threshold":150.0,"severe_threshold":1000.0,"active":false,"severe":false}],"latest_measurements":[{"check":"brightness","category":"low_light","value":0.726,"raw_value":0.9992,"direction":"below","enter_threshold":0.55,"exit_threshold":0.7,"severe_threshold":0.3,"active":false,"severe":false},{"check":"sharpness","category":"blur","value":0.9487,"raw_value":1.0007,"direction":"below","enter_threshold":0.4,"exit_threshold":0.55,"severe_threshold":0.2,"active":false,"severe":false},{"check":"obstruction","category":"obstruction","value":0.0,"raw_value":0.0,"direction":"above","enter_threshold":0.15,"exit_threshold":0.08,"severe_threshold":0.4,"active":false,"severe":false},{"check":"framing","category":"framing_change","value":0.9888,"raw_value":0.9891,"direction":"below","enter_threshold":0.7415,"exit_threshold":0.8415,"severe_threshold":0.4915,"active":false,"severe":false},{"check":"latency","category":"processing_latency","value":4.9268,"raw_value":3.534,"direction":"above","enter_threshold":250.0,"exit_threshold":150.0,"severe_threshold":1000.0,"active":false,"severe":false}],"worst_values":{"brightness":0.2048},"evidence":["t=9.40s brightness=0.247 is below enter threshold 0.550 (held 1.0s; severe at 0.300)","frame: brightness 22.47 (baseline 109.62), sharpness 8.31125 (baseline 9.83091), 640x360","t=11.00s DEGRADED -> UNTRUSTED: severe: brightness","t=16.47s UNTRUSTED -> RECOVERING: all checks back within exit thresholds"],"recommended_actions":["Check scene lighting, IR illuminator and expos